{
  "schema_version": 1,
  "project": "group/sub/project",
  "iid": 1234,
  "title": "Add retry logic to API client",
  "web_url": "https://gitlab.example.com/group/sub/project/-/merge_requests/1234",
  "mr_state": "opened",
  "source_branch": "feat/retry",
  "diff_refs": {
    "base_sha": "0000aaa",
    "start_sha": "0000bbb",
    "head_sha": "abc1234"
  },
  "me": {
    "id": 7,
    "username": "bongya",
    "can_resolve": true
  },
  "capabilities": {
    "draft_notes": true
  },
  "pulled_at": "2026-10-11T09:12:00+09:00",
  "rendered_at": null,
  "threads": [
    {
      "id": "a1b2c3d4e5f6",
      "root_note_id": 5566,
      "server": {
        "resolvable": true,
        "resolved": false,
        "repliable": true,
        "updated_at": "2026-10-05T06:30:00.000Z",
        "note_count": 1
      },
      "position": {
        "position_type": "text",
        "old_path": "src/api/client.py",
        "new_path": "src/api/client.py",
        "old_line": null,
        "new_line": 88,
        "line_range": null
      },
      "anchor": {
        "line": "    resp = session.get(url)",
        "context_before": [
          "def fetch(url):",
          "    session = make_session()"
        ],
        "context_after": [
          "    return resp.json()"
        ],
        "hunk": "@@ -84,6 +84,9 @@ def fetch(url):\n     session = make_session()\n+    resp = session.get(url)\n"
      },
      "location": {
        "path": "src/api/client.py",
        "line": 102,
        "line_end": null,
        "confidence": "exact",
        "method": "git-diff"
      },
      "notes": [
        {
          "id": 5566,
          "author": "jdoe",
          "created_at": "2026-10-05T05:02:11.000Z",
          "updated_at": "2026-10-05T05:02:11.000Z",
          "body": "타임아웃 설정이 빠졌습니다. 기본값이면 무한 대기할 수 있어요.",
          "mine": false,
          "suggestions": []
        }
      ],
      "local": {
        "state": "todo",
        "reply": "",
        "touched_at": null,
        "touched_by": null,
        "pushed_hash": null,
        "push_error": null
      }
    },
    {
      "id": "7a0b1c2d3e4f",
      "root_note_id": 5500,
      "server": {
        "resolvable": false,
        "resolved": false,
        "repliable": false,
        "updated_at": "2026-10-05T04:40:00.000Z",
        "note_count": 1
      },
      "position": null,
      "anchor": null,
      "location": null,
      "notes": [
        {
          "id": 5500,
          "author": "kim",
          "created_at": "2026-10-05T04:40:00.000Z",
          "updated_at": "2026-10-05T04:40:00.000Z",
          "body": "전반적으로 좋은데 타임아웃 쪽만 한 번 봐주세요.",
          "mine": false,
          "suggestions": []
        }
      ],
      "local": {
        "state": "todo",
        "reply": "",
        "touched_at": null,
        "touched_by": null,
        "pushed_hash": null,
        "push_error": null
      }
    }
  ]
}
